{
  "schemaVersion": "1.0.0",
  "reason": "Approved release override",
  "ticket": "OPS-124",
  "owner": "integration-test",
  "approvedBy": "exec-approver",
  "createdAt": "2026-04-15T00:00:00Z",
  "expiresAt": "2026-04-20T00:00:00Z",
  "referenceTime": "2026-04-15T00:00:00Z",
  "signature": "signed-external-approval",
  "scope": "profile"
}
